,tweet,polarity,subjectivity,Final
1694,travel booked a ticket online on the th of july and i was charged twice r x for a single ticket and only received one ticket called standard bank and went to mango and all these services told me to contact computticket did that but still no way forward,-0.023809523809523808,0.4047619047619047,Negative
1695,sme standard bank gauteng joblinks cv,0.0,0.0,No result
1696,head data quality transformation standard bank gauteng joblinks cv,0.0,0.0,No result
1697,mozambique central bank fines standard bank for fraudulent practices by manuel mucari via finance,0.0,0.125,No result
1698,mozambique central bank fines standard bank for fraudulent practices by manuel mucari via finance,0.0,0.125,No result
1699,sme standard bank gauteng resume jobs,0.0,0.0,No result
1700,sme standard bank gauteng resume joblinks,0.0,0.0,No result
1701,bloomberg standard bank,0.0,0.0,No result
1702,gtao the pacific standard bank job elite challenge get rid of finale ps gta,0.0,0.0,No result
1703,sme standard bank gauteng jobs resume,0.0,0.0,No result
1704,gtao pacific standard bank heist finale ps gta,0.0,0.0,No result
1705,ka okuhle good they should focus on capitec and standard bank atms they are owned by ramaphosas handlers maybe they might be some change when they start feeling the heat as well,0.35,0.30000000000000004,Positive
1706,banco de mo ambique aplica multa de quatro milh es de euros ao standard bank por infra es graves,0.0,0.0,No result
1707,empleado de municipalidad no ser s oqui jaja yo por suerte cumplo a os de emplado bancario boston standard bank icbc abrazo acad mico,0.0,0.0,No result
1708,standard bank suspenso da actividade cambial em mo ambique por um ano,0.0,0.0,No result
1709,mozambique central bank fines s standard bank for fraudulent practices reuters,0.0,0.125,No result
1710,edjo zandamela joba gove era banana mesmo bom standard bank,0.0,0.0,No result
1711,today i went to silverton mall to withdraw money at pick n pay and at standard bank but couldn t because this unrest so i m affected already,0.0,0.0,No result
1712,standard bank capitec bank blood bank fnb bank,0.0,0.0,No result
1713,i use standard bank,0.0,0.0,No result
1714,is the centurion standard bank branch operating,0.0,0.0,No result
1715,standard bank suspenso da actividade cambial por um ano,0.0,0.0,No result
1716,maseko fnb bank capitec bank blood bank standard bank,0.0,0.0,No result
1717,phase fnb absa standard bank nedbank and capitec,0.0,0.0,No result
1718,musiq standard bank mozambique has been fined m and suspended from the foreign exchange market in mozambique for a year while two top executives including ceo chuma nwokocha have also been fined and barred from bank management roles in mozambique for six years,0.125,0.20833333333333334,Positive
1719,banco de mo ambique aplica multa ao standard bank por infra es graves economiaaominuto,0.0,0.0,No result
1720,azola wits standard bank student number,0.0,0.0,No result
1721,watched financial co ads as waited for president to speak on allan gray standard bank outsurance coronation fnb then watched live looting at queensmead mall then watched a banal speech by our president on such a distressing day how do we make sense of anything,-0.03272727272727273,0.3,Negative
1722,that standard bank advertisement,0.0,0.0,No result
1723,algum economista aqui no twitter gostava de perceber ao certo o que aconteceu com o standard bank,0.0,0.0,No result
1724,standardbank suspenso por um ano de toda actividade cambial em mo ambique,0.0,0.0,No result
1725,vintage the standard bank of south africa partially used cheque book songea tanganyika,-0.05,0.15,Negative
1726,last line of hardliners remaining and they have been doing all it takes within anc to finish him cyril ramaphosa was their conduit and the reason he owns standard bank mtn group and a host of conglomerates of mines the anc struggle was hijacked and all the hardliners,0.0,0.03333333333333333,No result
1727,um ano sem transa es cambiais bruh isso querer levar o stb beira do abismo standard bank um dos bancos q tem ader ncia pra transa es cambiais e isso ter um impacto super negativo acho q o banco de mo ambique tomou medida severa para com esta situa o,0.16666666666666666,0.3333333333333333,Positive
1728,milly you know very well dischem will tell you nge standard bank card,0.1,0.15,Positive
1729,gran calculator cabonena fnb standard bank mtn and others close branches in gauteng kzn amid riots,0.0,0.0,No result
1730,gtao the pacific standard bank job heist elite challenge finale ps gta,0.0,0.0,No result
1731,timoteus fnb standard bank windhoek,0.0,0.0,No result
1732,oh i made a new cover by p with rikka s standard bank,0.06818181818181818,0.22727272727272727,Positive
1733,check the videos under shutdowngauteng i saw other niggas winning at an atm standard bank,0.125,0.375,Positive
1734,the old standard bank in johannesburg cbd still has my heart it d be a very chic city mansion,0.10000000000000002,0.16666666666666666,Positive
1735,n o consigo fazer movimentos na minha conta standard bank can o dos devedores do momento,0.0,0.0,No result
1736,fnb standard bank mtn and others close branches in gauteng kzn amid riots,0.0,0.0,No result
1737,fnb standard bank mtn and others close branches in gauteng kzn amid riots,0.0,0.0,No result
1738,fnb standard bank mtn and others close branches in gauteng kzn amid riots,0.0,0.0,No result
1739,fnb standard bank mtn and others close branches in gauteng kzn amid riots g d bless south africa the chaos is kwelled,0.0,0.0,No result
1740,rt the looters are now targeting atms i ve witnessed them trying to break open a standard bank absa and capitec atms,0.0,0.25,No result
1741,standard bank pay card is a reloadable mastercard and visa awesome list of prepaidcreditcard,0.5,0.5,Positive
1742,the looters are now targeting atms i ve witnessed them trying to break open a standard bank absa and capitec atms press,0.0,0.25,No result
1743,a suspens o do standard bank da actividade cambial de convers o de divisas ter dura o de ano segundo um comunicado do banco central publicado hoje ademais o banco e os gestores envolvidos nas infra es ter o que pagar mais de milh es de meticais em multas,0.0,0.125,No result
1744,travel booked a ticket online on the th of july and i was charged twice r x for a single ticket and only received one ticket called standard bank and went to mango and all these services told me to contact computticket did that but still nothing hhai bafethu,-0.023809523809523808,0.4047619047619047,Negative
1745,standard bank ihh,0.0,0.0,No result
1746,s nami even standard bank,0.0,0.0,No result
1747,very proud to announce bri africa a new partnership between the bri and standard bank group that will will bring together stakeholders from across africa to drive blockchain research and transformation africa,0.37878787878787873,0.48484848484848486,Positive
1748,the bri and standard bank group are excited to launch bri africa which will take an active role in coordinating sustainable blockchain development and innovation across the african continent blockchain africa innovation,0.06041666666666667,0.3375,Positive
1749,fnb standard bank mtn and others close branches in gauteng kzn amid riots news reported southafrica,0.0,0.0,No result
1750,okh our financial sector is predominantly in south african owned majority sa owned entities who ordinarily transact in rands case in point fnb nedbank standard bank,-0.0625,0.125,Negative
1751,siceloz called standard bank we can when all the insanity is over go to the cops and get an affidavit and they will reverse the charge,0.0,0.0,No result
1752,standardbank jsesbk view news article,0.0,0.0,No result
1753,fnb standard bank mtn and others close branches in gauteng kzn amid riots,0.0,0.0,No result
1754,standardbank jsesbk view news article,0.0,0.0,No result
1755,lol nah fam that s green on the picture and that s definitely an fnb atm i only know blue from standard bank and this is not it,0.10000000000000002,0.43333333333333335,Positive
1756,i was appointed contact person by standard bank after my husband s passing since then was there fraudulent activity by his flooz making the contact person sbtsays typos are accepted on wills i have corresponded with a mr mooko in feb and no responce,0.0,0.0,No result
1757,chainz standard bank,0.0,0.0,No result
1758,i don t think it was looting i think the mall made the decision to close and there was panic its pretty quiet and empty quite a bit of private security standing around outside on the road between the zone and standard bank but nothing out the ordinary,-0.014285714285714287,0.394047619047619,Negative
1759,i think even if you arent fnb or maybe standard bank you can ask them and apply to still recieve the money even if you arent with them,0.0,0.0,No result
1760,he somewhere in standard bank,0.0,0.0,No result
1761,this is not a standard bank omg chiyu ai real,0.1,0.15000000000000002,Positive
1762,someone from standard bank called me to offer me car and household insurance and i just said i don t have a car or a house and we just sat in silence for a second,0.0,0.0,No result
1763,wolf standard bank or capitec bank make up your mind,0.0,0.0,No result
1764,jazz on demand what to watch at this year s standard bank jazz festival naf trombonist siya charles performance showcasing the exciting future of south african jazz get our list of top picks,0.16,0.28500000000000003,Positive
1765,standard bank closing some branches it seems,0.0,0.0,No result
1766,mr price home and standard bank fnb will be too full,0.175,0.275,Positive
1767,looters please loot my student loan debt at standard bank please and thank you shutdownsa sandf makhumalo julius lesego,0.0,0.0,No result
1768,standard bank dear customer some of our branch services have been disrupted due to protest action impacting on our employee s ability to travel we encourage you to continue making use of our digital services like internet banking and the banking app,-0.006249999999999999,0.11875,Negative
1769,hi why should i have the standard bank mobile sim,0.0,0.0,No result
1770,why standard bank can not use for apple pay,0.0,0.0,No result
1771,standardbank you are telling is to use online banking that s not working either zumaunrest,0.0,0.0,No result
1772,engineer software job at standard bank july,0.0,0.0,No result
1773,gtao pacific standard bank heist signal setup ps gta,0.0,0.0,No result
1774,new post engineer software at standard bank has been published on job careers portal find the right job vacancies,0.14069264069264067,0.33008658008658004,Positive
1775,fnb absa nedbank and standard bank comrades,0.0,0.0,No result
1776,job opportunity at standard bank engineer software,0.0,0.0,No result
1777,manager institutional sales and corporate broking at standard bank group,0.0,0.0,No result
1778,the fnb app is years ahead of the standard bank app i have to go to the atm for the smallest thing,0.0,0.0,No result
1779,standard bank dear customer some of our branch services have been disrupted due to protest action impacting on our employee s ability to travel we encourage you to continue making use of our digital services like internet banking the banking app or our network of retail,-0.006249999999999999,0.11875,Negative
1780,where do i go if the standard bank atm scammed me money i went to the branch and they are not helping,0.0,0.0,No result
1781,well you did have nedbank and standard bank issues at the time that s what your app said,0.0,0.0,No result
1782,siya makuzeni trombone player vocalist lyricist and songwriter johnnie walker ambassador british council commissioned composer standard bank young artist for jazz recipient this august she will perform in the jazzy july lineup at market theatre,0.03333333333333333,0.13333333333333333,Positive
1783,la ngase standard bank,0.0,0.0,No result
1784,job opportunity at standard bank engineer software,0.0,0.0,No result
1785,job opportunity at standard bank engineer software tanzania newjobs jobs career newjobstz com,0.0,0.0,No result
1786,i wasnt aware that you owned standard bank,0.125,0.125,Positive
1787,latest job opportunities at standard bank,0.25,0.45,Positive
1788,lwandle this standard bank employee was protecting the money in the atm before looters came for it,0.0,0.0,No result
1789,standard bank jobs engineer and software jobs,0.0,0.0,No result
1790,morning entries july jse market bhp share stop loss absa share stop loss standard bank share stop loss truworths shares stop loss nedbank shares stop loss via,0.0,0.0,No result
1791,digital payments and ecommerce are on the rise in south africa thanks to standard bank s smart thinking their smallbusiness merchants can move their business online quickly safely and securely mastercardemployee,0.21904761904761905,0.3238095238095238,Positive
1792,what happened to standard bank deposit will the option ever be available it was taken down for maintenance and never returned,0.08148148148148147,0.22962962962962963,Positive
1793,job opportunity at standard bank engineer software,0.0,0.0,No result
1794,you girls should see what standard bank does to me,0.0,0.0,No result
1795,latest job opportunities at standard bank,0.25,0.45,Positive
1796,new post latest job opportunities at standard bank ikokazi ikokazike,0.21212121212121213,0.4515151515151515,Positive
1797,standard bank has become such a inconvenient bank,-0.19999999999999998,0.5,Negative
1798,gta the pacific standard bank elite challenge demoliton r ps gta,0.0,0.0,No result
1799,capitec and standard bank damaged literally no shop was left untouched shutdownsa shutdownkzn,0.0,0.0,No result
1800,the bank of mozambique imposed restrictions on the standard bank of sa due to alleged fx market manipulation standard s mozambique customers cannot receive transfers nor move deposits the metical had risen in april suggesting manipulation but has since stabilized,-0.05625,0.11875,Negative
1801,did the tv show ever come back dj coach is the master of the rented luxury lifestyle standard bank r via,0.0,0.0,No result
1802,capitec bank absa bank standard bank fnb bank african bank ned bank if yes i will teach you how you can earn r directly into your bank account it s very easy and quick but you will pay me of your profit when you receive your profit ask me how,0.1993333333333333,0.38,Positive
1803,poss veis impactos da suspens o do standard bank s a do mercado cambial,0.0,0.0,No result
1804,gtao the pacific standard bank job elite challenge testroute finaloop ps gta,0.0,0.0,No result
1805,more more of standard bank s unscrupulous banking practices exposed as more accounts are investigated unlawful interest rates not defined in the nca increasing the agreed rate as stated in the contract excessive monthly admin fees in contradiction of an appeal court judgment,0.25,0.5,Positive
1806,gtao the pacific standard bank job elite challenge get rid of finale ps gta,0.0,0.0,No result
1807,rise up and achieve by tuning in to the feature rise up mondays brought to you by on monday during za and get inspired to do more with your time and money as we chat to various individuals about their success stories standard bank it can be,0.2,0.25,Positive
1808,rise up and achieve by tuning in to the feature rise up mondays brought to you by on monday during za and get inspired to do more with your time and money as we chat to various individuals about their success stories standard bank it can be,0.2,0.25,Positive
1809,manager business transformation and program management at standard bank group,0.0,0.0,No result
1810,officer branch support south sudan at standard bank group,0.0,0.0,No result
1811,manager institutional sales and corporate broking at standard bank group,0.0,0.0,No result
1812,standardbank learnerships internship youth development programme kokong hlase maphepha,0.0,0.0,No result
1813,standard bank holidays then,0.0,0.0,No result
1814,gtao pacific standard bank heist signal setup ps gta,0.0,0.0,No result
1815,standard bank incentive cards is a non reloadable mastercard and visa this is goldmine of info prepaidcreditcard,0.0,0.0,No result
1816,a lot of people and organizations deserve a ftsek what does my finances have to do with you actually ever since i heard my dad trashing a standard bank ceo at a client s house i ve been smiling,0.0,0.05,No result
1817,gtao pacific standard bank heist finale ps gta,0.0,0.0,No result
1818,yoooooh rena mo limpopo reka looter standard bank,0.0,0.0,No result
1819,techzi mc donald standard bank and bidvest,0.0,0.0,No result
1820,if his voice doesn t sound like it s narrating a standard bank advert i don t want,0.2,0.2,Positive
1821,gtao pacific standard bank setup hack ps gta,0.0,0.0,No result
1822,what do i have to do to get someone to attend to my query i sent a complaint to complaint resolution centre almost months now still my query is outstanding is this what i get for being loyal to standard bank for years disappointing,-0.06111111111111111,0.4680555555555556,Negative
1823,maseko on some bengise standard bank,0.0,0.0,No result
1824,apparently standard bank has opted to close all its branches in kzn mrw,0.0,0.0,No result
1825,technologist maybe you need to follow the entire issue regarding standard bank my concern was havi posting confidential information from the banks and expecting the them to respond through twitter banks conduct their affairs professionaly not the pedestrial way havi conducts lsk affairs,0.0,0.3125,No result
1826,ground shattering scholarship worth she couldn t believe it kept asking me to help her verify it i m super delighted to welcome her to the close knit standard bank of africa chairman scholars community award number from our youtube community mind blowing,0.42666666666666664,0.47333333333333333,Positive
1827,hi everybody check out the siya charles sextet performance at the virtual standard bank jazz festival,0.0,0.0,No result
1828,i haven t heard much of her full to know i thought it was weird it d be a new standard bank can you imagine chiyu electric boogaloo,0.03727272727272728,0.4409090909090909,Positive
1829,gtao pacific standard bank heist finale ps gta,0.0,0.0,No result
1830,part of the body that is ticklish moghel a re hips familyfeudsa familyfeudafrica standardbank kfcsa,0.0,0.0,No result
1831,congratulations to them for winning r k voucher familyfeudsa familyfeudafrica itcanbe puresave etvonline standardbank kfcsa etvonline frythefeud rapidbluetv,0.5,0.75,Positive
1832,my team out again i don t know why i always get it wrong familyfeudsa familyfeudafrica standardbank itcanbe puresave,-0.5,0.9,Negative
1833,familyfeudsa itcanbe puresave standardbank familyfuedafrica njokweni family for the win,0.8,0.4,Positive
1834,the njokweni family familyfeudsa standardbank puresave itcanbe fastmoney,0.0,0.0,No result
1835,sibiya family familyfeudsa standardbank puresave itcanbe fastmoney,0.0,0.0,No result
1836,standard bank gift card is a non reloadable mastercard and visa you will love this prepaidcreditcard,0.25,0.3,Positive
1837,standardbank familyfeudsa iamsteveharveytv itcanbe puresave etvonline rapidbluetv team sibiya sotobe,0.0,0.0,No result
1838,feudafrica bank sibiya family,0.0,0.0,No result
1839,team sibiya familyfeudsa puresave standardbank etvonline itcanbe familyfeudafrica,0.0,0.0,No result
1840,the last time they were this excited for anything karabo on generations recovered from blindness and tkzee was performing at the standard bank arena,0.125,0.2722222222222222,Positive
1841,njokweni familyfeudafrica familyfeudsa standardbank itcanbe,0.0,0.0,No result
1842,sibiya family to go through fast money familyfeudafrica familyfeudsa puresave standardbank itcanbe kfcsa frythefeud etvonline rapidbluetv standardbank,0.2,0.6,Positive
1843,standardbank i m so disappointed fnb the glen offers collection of id passports but standard bank does not why not,-0.21666666666666667,0.25,Negative
1844,hawu ngasekhaya kubi this standard bank atm must be new ngoba angiyazi,0.06818181818181818,0.22727272727272727,Positive
1845,njokweni fastmoney familyfeudsa standardbank puresave itcanbe,0.0,0.0,No result
1846,wanangwa mwene this guy peaked when i was not even out of college in and around our run in the standard bank cup it s no lie what is him going to cosafa to achieve shouldn t it be used to nurture the upcoming players,0.0,0.0,No result
1847,i read this as sexually transmitted disease bank my head took me so long to remember you are talking about standard bank i scrolled down and came back to this tweet because i was like nooo mahn,0.05888888888888888,0.30444444444444446,Positive
1848,njokweni family will make it to fast money familyfuedafrica itcanbe puresave standardbank etvonline,0.2,0.6,Positive
1849,njokweni fastmoney familyfeudsa standardbank puresave itcanbe,0.0,0.0,No result
1850,njokweni fastmoney familyfeudsa standardbank puresave itcanbe,0.0,0.0,No result
1851,njokweni familyfeudsa standardbank puresave itcanbe kfc frythefeud rapidbluetv etvonline,0.0,0.0,No result
1852,family sibiya familyfeudafrica kfc etv steveharvey standardbank,0.0,0.0,No result
1853,the standard bank jazz festival makhanda is defined by an exciting programme of world class jazz musicians performed in a rare and accessible context alongside the standard bank national youth jazz festival sbnyjf,0.195,0.41500000000000004,Positive
1854,team njokweni fastmoney familyfeudsa standardbank puresave itcanbe,0.0,0.0,No result
1855,team sibaya fastmoney familyfeudsa standardbank puresave itcanbe,0.0,0.0,No result
1856,team njokweni fastmoney familyfeudsa standardbank puresave itcanbe,0.0,0.0,No result
1857,team sibaya fastmoney familyfeudsa standardbank puresave itcanbe,0.0,0.0,No result
1858,i got a message from standard bank saying no crypto or trading payment will be excepted by std bnk group,0.0,0.0,No result
1859,gcasamba here some programmes from standard bank,0.0,0.0,No result
1860,the nearest atm is by the garage km away but how can a shopping center not have standard bank atm,-0.05,0.05,Negative
1861,nope won t work only way is to send direct from airtel money to xapit has to be a working day and working hours standard bank transfer rules,0.03333333333333333,0.4666666666666666,Positive
1862,i am zuma supporter and i am ca working for standard bank whites always assume and think they know a black person this is a problem in this country the country will burn as long as there are those dangerous perception of black people,-0.19666666666666666,0.4333333333333334,Negative
1863,for playing in the standard bank festival was a defining moment in his early years enjoy as he shares his favourite aspects of the festival and his contribution this year aworldofarts youthjazz naf itcanbe mabandu,0.16666666666666666,0.26666666666666666,Positive
1864,wise mc donald and standard bank should be top of the list,0.39999999999999997,0.4666666666666666,Positive
1865,fromtheceo take it to church on day of naf with hope in a candlelight concert at pm headlined by standard bank ovation award winning afrosoul singer nomabotwe mtimkulu dedicated to those who have been struck by the pandemic,0.25,0.375,Positive
1866,ewallet standard bank,0.0,0.0,No result
1867,someone sent me money through the standard bank instant money thingy with no pin idc whether it was accidental just send the pin bro,0.0,0.3333333333333333,No result
1868,it is the online for the next week i can t wait to check the standard bank jazz festival performances as the world changes and festivals create for the online space to curb the spread of covid i am proud to be part of the alumni from the,0.26666666666666666,0.3333333333333333,Positive
1869,did you know that inside the pacific standard bank there is a framed layout blueprint of the bank gtaonline gtaphotographers virtualphotography gta,0.0,0.0,No result
1870,technologist people on twitter are not all members on lsk havi has been asked to been asked by the bank to provide resolutions of the special meeting that gave him the mandate to transact with the bank for now he is not an authorized signatory to the lsk accounts at standard bank,0.17857142857142858,0.2857142857142857,Positive
1871,standard bank group is the largest african banking group by assets offering a full range of banking and related financial services africa is our home we drive her growth our vision i for more information visit,0.14166666666666666,0.2416666666666667,Positive
1872,here is our church account number if you wish to pledge for us to stay on television house of praise ministries standard bank acc ref name tv production your support will be highly appreciated shalom,0.1,0.05,Positive
1873,i worked one month and a few days at standard bank when injanuary following year i received my congratulations call i got the job and not just the job but i was moving to pretoria the one city i fell inlove with the first visit man god is a wonder,0.012499999999999997,0.13333333333333333,Positive
1874,aw carlton centre i used to walk from standard bank to carlton lean against the wall watching barclays employees on smoke or tea or lunch breaks chatting outside and pray lord i m going to be one of them aren t i i wasn t sure but every time i watched them i saw myself,0.16666666666666666,0.31296296296296294,Positive
1875,gtao pacific standard bank heist finale ps gta,0.0,0.0,No result
1876,africansoil they must burn absa head offices bank city fnb standard bank aglo american and npa offices when white folks are affected shit will fall,-0.05,0.2,Negative
1877,capitec bank mathe te standard bank mathe te ewallet instant money cash send nedbank imali capitec linked number,0.0,0.3333333333333333,No result
1878,they also have this tendency of declining ppl unnecessarily they approved mine after seeing standard bank approval n me threatening to move my accounts all banks are the same just choose the devil i can tolerate,-0.13333333333333333,0.3416666666666666,Negative
